{
  "id": "jee_math_ch1",
  "title": "JEE Mathematics - Relations and Functions",
  "subject": "JEE Mathematics",
  "content": "Relations and Functions - Comprehensive Guide\n\nChapter 1: Fundamentals\n\nA relation is a set of ordered pairs. In mathematics, we represent relations between elements of two sets. For example, if we have sets A and B, a relation R from A to B is a subset of A × B.\n\nDefinition: A relation R from set A to set B is a subset of the Cartesian product A × B. If (a, b) ∈ R, we say that a is related to b under the relation R, denoted as aRb.\n\nExample: Let A = {1, 2, 3} and B = {a, b, c}. A possible relation could be R = {(1, a), (2, b), (3, c)}.\n\nTypes of Relations:\n1. Reflexive Relation: A relation R on set A is reflexive if (a, a) ∈ R for every a ∈ A.\n2. Symmetric Relation: A relation R is symmetric if (a, b) ∈ R implies (b, a) ∈ R.\n3. Transitive Relation: A relation R is transitive if (a, b) ∈ R and (b, c) ∈ R implies (a, c) ∈ R.\n4. Equivalence Relation: A relation that is reflexive, symmetric, and transitive.\n\nFunctions:\n\nA function is a special type of relation where each element of the domain has exactly one image in the codomain.\n\nDefinition: A function f from set A to set B, denoted f: A → B, is a relation where for every a ∈ A, there exists a unique b ∈ B such that (a, b) ∈ f.\n\nKey Terminology:\n- Domain: The set of all input values (set A)\n- Codomain: The set of all possible output values (set B)\n- Range: The set of all actual output values {f(a) | a ∈ A}\n- Image of a: The value f(a) corresponding to input a\n\nTypes of Functions:\n1. One-to-One (Injective): Different inputs map to different outputs. If f(a) = f(b), then a = b.\n2. Onto (Surjective): Every element of the codomain is mapped to by at least one element of the domain.\n3. Bijective: A function that is both one-to-one and onto.\n\nComposition of Functions:\n\nIf f: A → B and g: B → C are two functions, then the composition g ∘ f is defined as (g ∘ f)(a) = g(f(a)) for all a ∈ A.\n\nInverse of a Function:\n\nIf f: A → B is a bijection, then its inverse f⁻¹: B → A is defined such that f⁻¹(b) = a if and only if f(a) = b.\n\nProperties:\n- (f ∘ f⁻¹)(b) = b for all b ∈ B\n- (f⁻¹ ∘ f)(a) = a for all a ∈ A\n- (f⁻¹)⁻¹ = f\n\nGraphical Representation:\n\nThe vertical line test is used to determine if a graph represents a function. If any vertical line intersects the graph at more than one point, then it is not a function.\n\nPractice Problems:\n1. Verify which relations are equivalence relations\n2. Determine if given relations are functions\n3. Find the composition of two functions\n4. Determine if a function is bijective\n5. Find the inverse of a given function",
  "metadata": {
    "exam": "JEE",
    "difficulty": "Basic",
    "chapter": 1
  }
}
